id;nama;deskripsi;jumlah;rarity
C1;GFuel;Buat pas lagi mau rankup valo atau, mungkin, coding;10;B
C2;Flashpoint;Flashnya Breach biar lawan ngeliat matahari;69;B
C3;Shock Dart;Arrow with Shocking Soda-nya Sova;32;B
C4;Adeptus' Temptation;Buat koleksi saja karena waktu sudah buat ini kemungkinan besar sudah OP char Anda;80;A
C5;Potion of Regeneration II;Restores 18 health over time, 1 every 25 ticks;120;B
C6;N-Word Pass;A Pass to say the ever-so-exclusive N word;5;S
C7;Pfizer Covid-19 Vaccine;Pfizer's Covid-19 Vaccine, must receive 2 shots with 2 weeks inbetween each shots;128512;B
C8;Fucks;We only have a specific amount of Fucks we can give;22;A
